23:13:41.152494 IP 192.168.0.2.3296 > 192.168.0.1.23: S 1309338344:1309338344(0) win 65535 <mss 1460,nop,nop,sackOK>
23:13:41.161589 IP 192.168.0.1.23 > 192.168.0.2.3296: R 0:0(0) ack 1309338345 win 0
23:13:41.615867 IP 192.168.0.2.3296 > 192.168.0.1.23: S 1309338344:1309338344(0) win 65535 <mss 1460,nop,nop,sackOK>
23:13:41.616632 IP 192.168.0.1.23 > 192.168.0.2.3296: R 0:0(0) ack 1 win 0
23:13:42.123662 IP 192.168.0.2.3296 > 192.168.0.1.23: S 1309338344:1309338344(0) win 65535 <mss 1460,nop,nop,sackOK>
23:13:42.124381 IP 192.168.0.1.23 > 192.168.0.2.3296: R 0:0(0) ack 1 win 0
23:13:42.542268 IP 192.168.0.2.3297 > 16.157.68.137.7080: S 636615448:636615448(0) win 65535 <mss 1460,nop,nop,sackOK>
23:13:45.576717 IP 192.168.0.2.3297 > 16.157.68.137.7080: S 636615448:636615448(0) win 65535 <mss 1460,nop,nop,sackOK>
23:13:49.696012 IP 203.208.37.160.80 > 192.168.0.2.3290: F 2219941024:2219941024(0) ack 3703841792 win 8580
23:13:49.696045 IP 192.168.0.2.3290 > 203.208.37.160.80: . ack 1 win 64730
23:13:51.568789 IP 192.168.0.2.3297 > 16.157.68.137.7080: S 636615448:636615448(0) win 65535 <mss 1460,nop,nop,sackOK>
23:13:57.719215 IP 192.168.0.2.3290 > 203.208.37.160.80: F 1:1(0) ack 1 win 64730
23:13:57.752072 IP 203.208.37.160.80 > 192.168.0.2.3290: . ack 2 win 8580
23:14:03.565293 IP 192.168.0.2.3298 > 16.157.68.137.7080: S 1980533687:1980533687(0) win 65535 <mss 1460,nop,nop,sackOK>
23:14:03.741465 IP 74.125.107.38.80 > 192.168.0.2.3293: F 1787770899:1787770899(0) ack 3544770193 win 10956
23:14:03.741505 IP 192.168.0.2.3293 > 74.125.107.38.80: . ack 1 win 64238
23:14:03.774025 IP 192.168.0.2.3293 > 74.125.107.38.80: F 1:1(0) ack 1 win 64238
23:14:03.774573 IP 192.168.0.2.3299 > 74.125.107.38.80: S 1546282978:1546282978(0) win 65535 <mss 1460,nop,nop,sackOK>
23:14:04.052597 IP 74.125.107.38.80 > 192.168.0.2.3293: . ack 2 win 10956
23:14:04.054795 IP 74.125.107.38.80 > 192.168.0.2.3299: S 1848431867:1848431867(0) ack 1546282979 win 5840 <mss 1452,nop,nop,sackOK>
23:14:04.054825 IP 192.168.0.2.3299 > 74.125.107.38.80: . ack 1 win 65535
23:14:04.054937 IP 192.168.0.2.3299 > 74.125.107.38.80: P 1:912(911) ack 1 win 65535
23:14:04.356837 IP 74.125.107.38.80 > 192.168.0.2.3299: P 1:234(233) ack 912 win 7288
23:14:04.359426 IP 74.125.107.38.80 > 192.168.0.2.3299: P 234:823(589) ack 912 win 7288
23:14:04.359450 IP 192.168.0.2.3299 > 74.125.107.38.80: . ack 823 win 64713
23:14:06.599728 IP 192.168.0.2.3298 > 16.157.68.137.7080: S 1980533687:1980533687(0) win 65535 <mss 1460,nop,nop,sackOK>

23:24:24.685518 IP 192.168.0.2.3313 > 16.157.68.137.7080: S 2262311672:2262311672(0) win 65535 <mss 1460,nop,nop,sackOK>
23:24:27.648809 IP 192.168.0.2.3313 > 16.157.68.137.7080: S 2262311672:2262311672(0) win 65535 <mss 1460,nop,nop,sackOK>
23:24:30.194673 IP 192.168.0.2.3314 > 192.168.0.1.23: S 3161595665:3161595665(0) win 65535 <mss 1460,nop,nop,sackOK>
23:24:30.195920 IP 192.168.0.1.23 > 192.168.0.2.3314: R 0:0(0) ack 3161595666 win 0
23:24:30.477286 IP 192.168.0.2.3315 > 16.234.96.101.443: S 3690906757:3690906757(0) win 65535 <mss 1460,nop,nop,sackOK>
23:24:30.594067 IP 192.168.0.2.3314 > 192.168.0.1.23: S 3161595665:3161595665(0) win 65535 <mss 1460,nop,nop,sackOK>
23:24:30.594832 IP 192.168.0.1.23 > 192.168.0.2.3314: R 0:0(0) ack 1 win 0
23:24:31.101865 IP 192.168.0.2.3314 > 192.168.0.1.23: S 3161595665:3161595665(0) win 65535 <mss 1460,nop,nop,sackOK>
23:24:31.102631 IP 192.168.0.1.23 > 192.168.0.2.3314: R 0:0(0) ack 1 win 0

